date,product_id,type,attr,from,to
2025-08-22,1021,change,description," Description Experience ultimate comfort and contemporary style with the Greenport Loose Fit Trousers. Now crafted from our new, durable herringbone fabric, this offers enhanced durability and takes brilliantly to colour for a richer, lasting hue. These trousers feature an adjustable elasticated waistband with an cotton drawstring for a custom, comfortable fit. Finished with practical back patch pockets and iconic Farah tab branding, the Greenport trousers blend laid-back style with everyday utility. Elastic Waistband With Internal Drawcord Back Patch Pockets Iconic Farah Tab Branding Fit Loose Fit Designed To Sit Mid Waist. Loose Though The Thigh Down To A Wide Hem Composition And Care 100% Cotton Premium Herringbone Fabrication For Comfort And Durability Machine Wash "," Description Introducing our Greenport Herringbone Trousers, designed for both style and comfort. These trousers feature a loose fit and a convenient drawstring waistband. Take a closer look at the fabric, and you'll notice a subtle yet sophisticated herringbone pattern. This classic twill weave creates a series of parallel zig-zags throughout the material, adding a unique texture and visual interest. Crafted from a versatile herringbone twill fabric, these trousers are inspired by classic military and workwear styles, but we've updated them with our most contemporary wide fit. This makes them a perfect, modern piece that you can wear across all seasons. Pair them with our matching Marshall Overshirt for a complete and cohesive look. Elastic Waistband With Internal Drawcord Back Patch Pockets Iconic Farah Tab Branding Fit Loose Fit Designed To Sit Mid Waist. Loose Though The Thigh Down To A Wide Hem Composition And Care 100% Cotton Premium Herringbone Fabrication For Comfort And Durability Machine Wash "
2025-08-22,1072,change,description," Description Elevate your wardrobe with our Adam Archive Trousers. Featuring a luxurious texture and modern loose tapered fit, these full-length trousers are defined by their distinctive double pleated gathering for a sophisticated drape. Seamlessly transitioning from casual days to stylish nights out, they're complete with minimalistic logo detailing, unique button placement, and our signature Farah® Waist Label for timeless appeal. Archive Inspired Double Pleated Trouser Button Fastening With A Metal Zip Fly And Extended Waistband External Coin Pocket With Buttoned Flap Back Welt Pocket With Flap And Button Iconic Farah Tab Branding Fit Loose Tapered Fit Designed To Sit Higher At The Waist. Loose Though The Thigh And Tapers To A Wide Hem Composition And Care 100% Organic Cotton 6 Wale Cord Fabrication Machine Wash "," Description We're excited to introduce the Adam Cord Trousers, a double pleated trouser inspired by our history. This pair is a direct replica of an original from our archive, staying completely faithful to the original design and colourway. It's a slightly smarter trouser, but the corduroy fabric gives it a relaxed feel, keeping it from being too formal while still maintaining that timeless, heritage style. Archive Inspired Double Pleated Trouser Button Fastening With A Metal Zip Fly And Extended Waistband External Coin Pocket With Buttoned Flap Back Welt Pocket With Flap And Button Iconic Farah Tab Branding Fit Loose Tapered Fit Designed To Sit Higher At The Waist. Loose Though The Thigh And Tapers To A Wide Hem Composition And Care 100% Organic Cotton 6 Wale Cord Fabrication Machine Wash "
2025-08-22,1023,change,description," Description Experience ultimate comfort and contemporary style with the Greenport Loose Fit Trousers. Now crafted from our new, durable herringbone fabric, this offers enhanced durability and takes brilliantly to colour for a richer, lasting hue. These trousers feature an adjustable elasticated waistband with an cotton drawstring for a custom, comfortable fit. Finished with practical back patch pockets and iconic Farah tab branding, the Greenport trousers blend laid-back style with everyday utility. Elastic Waistband With Internal Drawcord Back Patch Pockets Iconic Farah Tab Branding Fit Loose Fit Designed To Sit Mid Waist. Loose Though The Thigh Down To A Wide Hem Composition And Care 100% Cotton Premium Herringbone Fabrication For Comfort And Durability Machine Wash "," Description Introducing our Greenport Herringbone Trousers, designed for both style and comfort. These trousers feature a loose fit and a convenient drawstring waistband. Take a closer look at the fabric, and you'll notice a subtle yet sophisticated herringbone pattern. This classic twill weave creates a series of parallel zig-zags throughout the material, adding a unique texture and visual interest. Crafted from a versatile herringbone twill fabric, these trousers are inspired by classic military and workwear styles, but we've updated them with our most contemporary wide fit. This makes them a perfect, modern piece that you can wear across all seasons. Pair them with our matching Marshall Overshirt for a complete and cohesive look. Elastic Waistband With Internal Drawcord Back Patch Pockets Iconic Farah Tab Branding Fit Loose Fit Designed To Sit Mid Waist. Loose Though The Thigh Down To A Wide Hem Composition And Care 100% Cotton Premium Herringbone Fabrication For Comfort And Durability Machine Wash "
2025-08-22,1022,change,description," Description Experience ultimate comfort and contemporary style with the Greenport Loose Fit Trousers. Now crafted from our new, durable herringbone fabric, this offers enhanced durability and takes brilliantly to colour for a richer, lasting hue. These trousers feature an adjustable elasticated waistband with an cotton drawstring for a custom, comfortable fit. Finished with practical back patch pockets and iconic Farah tab branding, the Greenport trousers blend laid-back style with everyday utility. Elastic Waistband With Internal Drawcord Back Patch Pockets Iconic Farah Tab Branding Fit Loose Fit Designed To Sit Mid Waist. Loose Though The Thigh Down To A Wide Hem Composition And Care 100% Cotton Premium Herringbone Fabrication For Comfort And Durability Machine Wash "," Description Introducing our Greenport Herringbone Trousers, designed for both style and comfort. These trousers feature a loose fit and a convenient drawstring waistband. Take a closer look at the fabric, and you'll notice a subtle yet sophisticated herringbone pattern. This classic twill weave creates a series of parallel zig-zags throughout the material, adding a unique texture and visual interest. Crafted from a versatile herringbone twill fabric, these trousers are inspired by classic military and workwear styles, but we've updated them with our most contemporary wide fit. This makes them a perfect, modern piece that you can wear across all seasons. Pair them with our matching Marshall Overshirt for a complete and cohesive look. Elastic Waistband With Internal Drawcord Back Patch Pockets Iconic Farah Tab Branding Fit Loose Fit Designed To Sit Mid Waist. Loose Though The Thigh Down To A Wide Hem Composition And Care 100% Cotton Premium Herringbone Fabrication For Comfort And Durability Machine Wash "
2025-08-22,1024,change,description," Description Wrap yourself in instant comfort with the Mews 1/4 Zip Fleece. This versatile layering piece combines supreme softness with a classic design, making it your go-to for effortless warmth Funnel Neck Tonal Hopsack Kangaroo Pocket Cinching Drawstring Waistband With Toggles Embroidered Gold F Fit Relaxed Fit Designed to be looser around the body for a casual, contemporary look. Composition And Care 100% Recycled Polyester Sherpa Fleece Fabrication For Warmth And Comfort Machine Wash "," Description Meet our new Mews Fleece, the perfect blend of warmth and style. This relaxed-fit fleece is crafted from a double-bonded fabric, featuring a thick pile, insulating sherpa fleece on the outside and a smooth inner layer to keep you warm and comfortable. The design includes a unique poly hopsack kangaroo pocket on the front, dyed to perfectly match the fleece's body—a nod to our classic trouser heritage. Plus, with a drop shoulder and a wide body for that relaxed fit, you can use the drawstring and toggles at the hem to cinch it in and create your own shape. Funnel Neck Tonal Hopsack Kangaroo Pocket Cinching Drawstring Waistband With Toggles Embroidered Gold F Fit Relaxed Fit Designed to be looser around the body for a casual, contemporary look. Composition And Care 100% Recycled Polyester Sherpa Fleece Fabrication For Warmth And Comfort Machine Wash "
2025-08-22,1027,change,description," Description Embrace understated heritage with the Lynmouth Graphic Sweater. This timeless piece blends classic comfort with a refined tonal logo, making it a versatile wardrobe staple. It's cut for a comfortable, regular fit that provides ease of movement while maintaining a smart, refined profile. Plus, it's finished with fine ribbed detailing on the cuffs and hem, ensuring a secure fit and enhanced durability. Crew Neck Set In Ribbed Collar Embroidered Farah Script Graphic Ribbed Cuffs And Hem Fit Regular Fit Designed to sit neither too tight or too baggy, offering everyday style and comfort. Composition And Care 100% Organic Cotton Comfortable Fleece Fabrication Machine Wash "," Description Embrace understated heritage with the Lynmouth Graphic Sweater. The Farah since 1920 script across the chest is taken from our vintage branding and is expertly embroidered with cotton thread with a contrasting navy stitch. It also features slightly taller cuffs than a standard sweatshirt, a design detail emulating classic vintage wear to give it an authentic, retro feel. Crew Neck Set In Ribbed Collar Embroidered Farah Script Graphic Ribbed Cuffs And Hem Fit Regular Fit Designed to sit neither too tight or too baggy, offering everyday style and comfort. Composition And Care 100% Organic Cotton Comfortable Fleece Fabrication Machine Wash "
2025-08-22,1030,change,description," Description Wrap yourself in instant comfort with the Mews 1/4 Zip Fleece. This versatile layering piece combines supreme softness with a classic design, making it your go-to for effortless warmth Funnel Neck Tonal Hopsack Kangaroo Pocket Cinching Drawstring Waistband With Toggles Embroidered Gold F Fit Relaxed Fit Designed to be looser around the body for a casual, contemporary look. Composition And Care 100% Recycled Polyester Sherpa Fleece Fabrication For Warmth And Comfort Machine Wash "," Description Meet our new Mews Fleece, the perfect blend of warmth and style. This relaxed-fit fleece is crafted from a double-bonded fabric, featuring a thick pile, insulating sherpa fleece on the outside and a smooth inner layer to keep you warm and comfortable. The design includes a unique poly hopsack kangaroo pocket on the front, dyed to perfectly match the fleece's body—a nod to our classic trouser heritage. Plus, with a drop shoulder and a wide body for that relaxed fit, you can use the drawstring and toggles at the hem to cinch it in and create your own shape. Funnel Neck Tonal Hopsack Kangaroo Pocket Cinching Drawstring Waistband With Toggles Embroidered Gold F Fit Relaxed Fit Designed to be looser around the body for a casual, contemporary look. Composition And Care 100% Recycled Polyester Sherpa Fleece Fabrication For Warmth And Comfort Machine Wash "
2025-08-22,1028,change,description," Description Level up your layering game with the Seaton Zip Through Sweatshirt. This isn't just any zip-up; it's got that premium woven textured fabric that feels as good as it looks. With a sleek funnel neck and metallic zip-through detail, it's all about sharp style and easy comfort. Plus, that classic embroidered gold 'F' logo gives it a subtle nod to heritage. Throw it on over a tee, under a jacket, or just rock it solo. It's your new go-to for effortless, casual cool. Funnel Neck Full Length Double Ended Zipper Ribbed Cuffs And Hem Embroidered Gold F Fit Regular Fit Designed to sit neither too tight or too baggy, offering everyday style and comfort. Composition And Care 100% Organic Cotton Premium Waffle Texture Fabrication Machine Wash "," Description Introducing our new Seaton Zip Through Sweatshirt. This style features a full zip and a classic funnel neck for a clean look. While it's a lightweight, single knit, don't let that fool you—the dense weave gives it a lot of body and a unique feel. Up close, you'll notice a distinct basket weave texture, created by a zigzag of stitches that are woven together for a rich and visually interesting finish. Funnel Neck Full Length Double Ended Zipper Ribbed Cuffs And Hem Embroidered Gold F Fit Regular Fit Designed to sit neither too tight or too baggy, offering everyday style and comfort. Composition And Care 100% Organic Cotton Premium Waffle Texture Fabrication Machine Wash "
2025-08-22,1073,new-price,price,,85.00
2025-08-22,1074,new-price,price,,80.00
2025-08-22,1075,new-price,price,,85.00
2025-08-22,1076,new-price,price,,80.00
