date,product_id,type,attr,from,to
2025-01-24,871,change,description," 100% Organic Cotton Regular Fit Short Sleeve Premium Organic Cotton Jersey Fabrication Traditional Breton Style Stripe Design Set In Ribbed Collar Twin Needle Finish To Cuffs And Hem Embroidered Gold F Model Is 6'2"" And Wears Size Medium Machine Wash "," Expertly crafted from premium organic cotton jersey, this Oakland Bretton Stripe T-Shirt is a must-have for any wardrobe. Featuring a classic Breton stripe design and an embroidered gold F logo, this t-shirt combines timeless style with sustainable fabric. 100% Organic Cotton Regular Fit Short Sleeve Premium Organic Cotton Jersey Fabrication Traditional Breton Style Stripe Design Set In Ribbed Collar Twin Needle Finish To Cuffs And Hem Embroidered Gold F Model Is 6'2"" And Wears Size Medium Machine Wash Shop The Organic Collection Here "
2025-01-24,872,change,description," 100% Organic Cotton Regular Fit Short Sleeve Premium Heavyweight Organic Cotton Jersey Fabrication Set-In Collar Twin Needle Finish To Cuffs And Hem Mitred Stitch Patch Pocket On The Chest Iconic Farah Tab Branding Model Is 6'2"" And Wears Size Medium Machine Wash "," Made from 100% organic cotton, you’re guaranteed to feel as good as you look when you put on our Stacy tee. The regular fit combined with short sleeves, combines comfort with functionality, without compromising style. It’s the details that make this a must-have piece; the jersey fabrication, the set-in collar, the twin needle finish to the cuff and hem, and the mitred stitch patch pocket on the chest. All finished off with iconic Farah tab branding. 100% Organic Cotton Regular Fit Short Sleeve Premium Heavyweight Organic Cotton Jersey Fabrication Set-In Collar Twin Needle Finish To Cuffs And Hem Mitred Stitch Patch Pocket On The Chest Iconic Farah Tab Branding Model Is 6'2"" And Wears Size Medium Machine Wash Shop The Organic Collection Here "
2025-01-24,876,change,description," 100% Organic Cotton Regular Fit Short Sleeve Premium Organic Cotton Jersey Fabrication 3 Button Grown On Placket Jacquard Micro Check Tonal Ribbed Collar Twin Needle Finish To Hem And Cuff Embroidered Gold F Model Is 6'2"" And Wears Size Medium Machine Wash "," 100% Organic Cotton Regular Fit Short Sleeve Premium Organic Cotton Jersey Fabrication 3 Button Grown On Placket Jacquard Micro Check Tonal Ribbed Collar Twin Needle Finish To Hem And Cuff Embroidered Gold F Model Is 6'2"" And Wears Size Medium Machine Wash Shop The Organic Collection Here "
2025-01-24,866,change,description," 100% Organic Cotton Slim Fit Long Sleeve Premium Organic Cotton Woven Stripe Oxford Fabrication Button Down Collar Constructed Working Cuffs Traditional Cut And Sew Button Placket Farah Branded Button Fastenings Curved Hem Embroidered Gold F Model Is 6'2"" And Wears Size Medium Machine Wash "," The Brewer Striped Oxford Shirt adds a smart stripe design to elevate the classic Farah Brewer. Also featuring a button down collar, the smart casual aesthetic is completed with the signature gold Farah logo. 100% Organic Cotton Slim Fit Long Sleeve Premium Organic Cotton Woven Stripe Oxford Fabrication Button Down Collar Constructed Working Cuffs Traditional Cut And Sew Button Placket Farah Branded Button Fastenings Curved Hem Embroidered Gold F Model Is 6'2"" And Wears Size Medium Machine Wash Shop The Organic Collection Here "
2025-01-24,877,change,description," 100% Organic Cotton Relaxed Fit 12 Gauge Knitted Construction With 2 Colour Jacquard Detailing Oversized Knitted Collar And Placket Tonal Ribbed Collar And Cuff Cut And Sew Armhole Construction Embroidered Gold F Model Is 6'2"" And Wears Size Medium Machine Wash "," 100% Organic Cotton Relaxed Fit 12 Gauge Knitted Construction With 2 Colour Jacquard Detailing Oversized Knitted Collar And Placket Tonal Ribbed Collar And Cuff Cut And Sew Armhole Construction Embroidered Gold F Model Is 6'2"" And Wears Size Medium Machine Wash Shop The Organic Collection Here "
2025-01-24,496,change,description," 100% Cotton Relaxed Fit Long Sleeve Premium Cotton Twill Fabrication Concealed Button Placket Farah Branded Button Fastenings Twin Patch Pockets Back Yoke With Edge Stitching Iconic Farah Tab Branding Model Is 6'2"" And Wears Size Medium Machine Wash "," The Leon Overshirt offers a smart layering option that is a great alternative to a coat or jacket. Crafted from a heavy weight cotton in a relaxed fit for all day comfort, it features 2 practical yet stylish pockets. A concealed placket and subtle Farah tab branding complete the look for this smart, wardrobe must have. 100% Cotton Relaxed Fit Long Sleeve Premium Cotton Twill Fabrication Concealed Button Placket Farah Branded Button Fastenings Twin Patch Pockets Back Yoke With Edge Stitching Iconic Farah Tab Branding Model Is 6'2"" And Wears Size Medium Machine Wash "
2025-01-24,853,change,description," 100% Organic Cotton Loose Fit. Designed To Sit Mid Waist. Loose Though The Thigh Down To A Wide Hem Premium Organic Cotton Canvas Fabrication Elastic Waistband With Internal Drawcord Back Patch Pockets Concealed Coin Pocket Iconic Farah Tab Branding Model Is 6'2"" And Wears Size M Machine Wash "," 100% Organic Cotton Loose Fit. Designed To Sit Mid Waist. Loose Though The Thigh Down To A Wide Hem Premium Organic Cotton Canvas Fabrication Elastic Waistband With Internal Drawcord Back Patch Pockets Concealed Coin Pocket Iconic Farah Tab Branding Model Is 6'2"" And Wears Size M Machine Wash Shop The Organic Collection Here "
2025-01-24,878,change,description," 100% Organic Cotton Relaxed Fit Short Sleeve Premium Organic Cotton Paper Touch Poplin Fabrication One Piece Point Collar Farah Branded Button Fastenings Straight Hem Single Patch Pocket Back Yoke With Edge Stitching And Hanging Loop Iconic Farah Tab Branding Model Is 6'2"" And Wears Size Medium Machine Wash "," 100% Organic Cotton Relaxed Fit Short Sleeve Premium Organic Cotton Paper Touch Poplin Fabrication One Piece Point Collar Farah Branded Button Fastenings Straight Hem Single Patch Pocket Back Yoke With Edge Stitching And Hanging Loop Iconic Farah Tab Branding Model Is 6'2"" And Wears Size Medium Machine Wash Shop The Organic Collection Here "
2025-01-24,857,change,description," 100% Organic Cotton Slim Fit Long Sleeve Premium Organic Cotton Brushed Marl Woven Fabrication Button Down Collar Constructed Working Cuffs Traditional Cut And Sew Button Placket Farah Branded Button Fastenings Curved Hem Embroidered Gold F Model Is 6'2"" And Wears Size Medium Machine Wash "," The Farah Steen Slim Fit Brushed Cotton shirt is the perfect addition to your wardrobe. Using 100% organic brushed cotton for a soft-touch, smart casual look with premium elegance; the slim-fit, long-sleeve design details a traditional button-down collar with signature gold embroidered Farah logo at the left chest. 100% Organic Cotton Slim Fit Long Sleeve Premium Organic Cotton Brushed Marl Woven Fabrication Button Down Collar Constructed Working Cuffs Traditional Cut And Sew Button Placket Farah Branded Button Fastenings Curved Hem Embroidered Gold F Model Is 6'2"" And Wears Size Medium Machine Wash Shop The Organic Collection Here "
2025-01-24,865,change,description," 100% Cotton Relaxed Fit Long Sleeve Premium Cotton Twill Fabrication Concealed Button Placket Farah Branded Button Fastenings Twin Patch Pockets Back Yoke With Edge Stitching Iconic Farah Tab Branding Model Is 6'2"" And Wears Size Medium Machine Wash "," The Leon Overshirt offers a smart layering option that is a great alternative to a coat or jacket. Crafted from a heavy weight cotton in a relaxed fit for all day comfort, it features 2 practical yet stylish pockets. A concealed placket and subtle Farah tab branding complete the look for this smart, wardrobe must have. 100% Cotton Relaxed Fit Long Sleeve Premium Cotton Twill Fabrication Concealed Button Placket Farah Branded Button Fastenings Twin Patch Pockets Back Yoke With Edge Stitching Iconic Farah Tab Branding Model Is 6'2"" And Wears Size Medium Machine Wash "
2025-01-24,854,change,description," 100% Organic Cotton Relaxed Tapered Fit. Designed To Sit Mid Waist. Relaxed Though The Thigh And Tapers To A Wide, Cropped Hem Premium Cotton Seersucker Fabrication Elastic Waistband With Internal Drawcord Back Patch Pocket Concealed Coin Pocket Iconic Farah Tab Branding Model Is 6'2"" And Wears Size M Machine Wash "," 100% Organic Cotton Relaxed Tapered Fit. Designed To Sit Mid Waist. Relaxed Though The Thigh And Tapers To A Wide, Cropped Hem Premium Cotton Seersucker Fabrication Elastic Waistband With Internal Drawcord Back Patch Pocket Concealed Coin Pocket Iconic Farah Tab Branding Model Is 6'2"" And Wears Size M Machine Wash Shop The Organic Collection Here "
2025-01-24,880,change,description," 100% Organic Cotton Slim Fit Premium Organic Cotton Loopback Jersey Fabrication Set In Funnel-Neck Collar With A Metal Farah Branded Ring-Puller Chain-Stitched Raglan Sleeve Construction Ribbed Neck, Cuffs And Hem Embroidered Gold F Branding Model Is 6'2"" And Wears Size Medium Machine Wash "," Made from 100% organic cotton, the Farah Jim sweatshirt features a quarter-zip set into a deep, ribbed-neck collar. With matching detailing on the hem and cuffs, the slim-fit sweatshirt is available with our signature gold Farah logo at the left chest. 100% Organic Cotton Slim Fit Premium Organic Cotton Loopback Jersey Fabrication Set In Funnel-Neck Collar With A Metal Farah Branded Ring-Puller Chain-Stitched Raglan Sleeve Construction Ribbed Neck, Cuffs And Hem Embroidered Gold F Branding Model Is 6'2"" And Wears Size Medium Machine Wash Shop The Organic Collection Here "
2025-01-24,881,change,description," 100% Organic Cotton Regular Fit Short Sleeve Premium Heavyweight Organic Cotton Jersey Fabrication Pizza Inspired 2 Colour Graphic Set-In Collar Twin Needle Finish To Cuffs And Hem Model Is 6'2"" And Wears Size Medium Machine Wash "," 100% Organic Cotton Regular Fit Short Sleeve Premium Heavyweight Organic Cotton Jersey Fabrication Pizza Inspired 2 Colour Graphic Set-In Collar Twin Needle Finish To Cuffs And Hem Model Is 6'2"" And Wears Size Medium Machine Wash Shop The Organic Collection Here "
2025-01-24,852,change,description," 100% Organic Cotton Slim Fit Long Sleeve Premium Organic Cotton Woven Oxford Fabrication Button Down Collar Constructed Working Cuffs Traditional Cut And Sew Button Placket Farah Branded Button Fastenings Curved Hem Embroidered Gold F Model Is 6'2"" And Wears Size Medium Machine Wash "," The Farah Brewer Oxford shirt is an essential, modern menswear classic. Expertly crafted from 100% organic cotton, the Brewer Oxford shirt boasts a button-down collar, long sleeves, and a curved hem for a stylish, must-have wardrobe staple. The Oxford weave provides a classic feel with added durability, while the signature gold Farah logo provides the perfect finishing touch. 100% Organic Cotton Slim Fit Long Sleeve Premium Organic Cotton Woven Oxford Fabrication Button Down Collar Constructed Working Cuffs Traditional Cut And Sew Button Placket Farah Branded Button Fastenings Curved Hem Embroidered Gold F Model Is 6'2"" And Wears Size Medium Machine Wash Shop The Organic Collection Here "
2025-01-24,862,change,description," 100% Organic Cotton Slim Fit Long Sleeve Premium Organic Cotton Woven 3 Colour Check Oxford Fabrication Button Down Collar Constructed Working Cuffs Traditional Cut And Sew Button Placket Farah Branded Button Fastenings Curved Hem Embroidered Gold F Model Is 6'2"" And Wears Size Medium Machine Wash "," The Farah Brewer Check Oxford Shirt is a long sleeve, slim-fit shirt with a traditional button-down collar. Featuring a classic check in an Oxford-weave using 100% organic cotton with our signature gold Farah logo at the left chest, it’s a perfect selection to refresh your wardrobe. 100% Organic Cotton Slim Fit Long Sleeve Premium Organic Cotton Woven 3 Colour Check Oxford Fabrication Button Down Collar Constructed Working Cuffs Traditional Cut And Sew Button Placket Farah Branded Button Fastenings Curved Hem Embroidered Gold F Model Is 6'2"" And Wears Size Medium Machine Wash Shop The Organic Collection Here "
2025-01-24,884,change,description," 100% Organic Cotton Regular Fit Short Sleeve Premium Organic Cotton Jersey Fabrication Set In Ribbed Collar Twin Needle Finish To Cuffs And Hem Embroidered Gold F Model Is 6'2"" And Wears Size Medium Machine Wash "," Your basic pieces should be anything but. Our Danny tee is made from 100% organic cotton, soft against your skin and highly breathable. The regular fit and short sleeves make it the perfect accompaniment for any outfit; wear with jeans or chinos or layer a jumper on top when there’s a chill in the air. Look closer and you’ll notice those classic Farah details you’ve come to expect, including a set in ribbed collar and twin needle finishes to the cuffs and hem. And, of course, the embroidered golf F branding on the chest. 100% Organic Cotton Regular Fit Short Sleeve Premium Organic Cotton Jersey Fabrication Set In Ribbed Collar Twin Needle Finish To Cuffs And Hem Embroidered Gold F Model Is 6'2"" And Wears Size Medium Machine Wash Shop The Organic Collection Here "
2025-01-24,885,change,description," 100% Organic Cotton Slim Fit Short Sleeve Premium Organic Cotton Pique Fabrication 3 Button Grown On Placket Ribbed Collar And Cuff Twin Needle Finish To Hem Embroidered Gold F Model Is 6'2"" And Wears Size Medium Machine Wash "," A timeless piece that is anything but basic, the Farah Blanes is a slim-fit, short-sleeved polo shirt that features classic Farah design details including a three-button placket, piqué fabrication, and ribbed collar and cuffs. Made from 100% organic cotton, the short-sleeve polo comes with our signature gold Farah logo on the left chest. 100% Organic Cotton Slim Fit Short Sleeve Premium Organic Cotton Pique Fabrication 3 Button Grown On Placket Ribbed Collar And Cuff Twin Needle Finish To Hem Embroidered Gold F Model Is 6'2"" And Wears Size Medium Machine Wash Shop The Organic Collection Here "
2025-01-24,889,change,description," 100% Organic Cotton Relaxed Fit Short Sleeve Premium Organic Cotton Paper Touch Poplin Fabrication One Piece Point Collar Farah Branded Button Fastenings Straight Hem Single Patch Pocket Back Yoke With Edge Stitching And Hanging Loop Iconic Farah Tab Branding Model Is 6'2"" And Wears Size Medium Machine Wash "," 100% Organic Cotton Relaxed Fit Short Sleeve Premium Organic Cotton Paper Touch Poplin Fabrication One Piece Point Collar Farah Branded Button Fastenings Straight Hem Single Patch Pocket Back Yoke With Edge Stitching And Hanging Loop Iconic Farah Tab Branding Model Is 6'2"" And Wears Size Medium Machine Wash Shop The Organic Collection Here "
2025-01-24,890,change,description," 100% Organic Cotton Slim Fit Crew Neck Premium Organic Cotton Loopback Jersey Fabrication Set In Rib Collar With Chain-Stitched Rib Reinforcement Ribbed Cuffs And Hem Embroidered Gold F Branding Model Is 6'2"" And Wears Size Medium Machine Wash "," Expertly crafted from organic cotton, the Tim Sweatshirt features a premium loopback jersey fabrication for ultimate comfort. The ribbed collar with chain-stitched rib reinforcement adds durability, while the ribbed cuffs and hem provide a snug fit. Finished with an embroidered Farah logo, this sweatshirt is a must-have for any wardrobe. 100% Organic Cotton Slim Fit Crew Neck Premium Organic Cotton Loopback Jersey Fabrication Set In Rib Collar With Chain-Stitched Rib Reinforcement Ribbed Cuffs And Hem Embroidered Gold F Branding Model Is 6'2"" And Wears Size Medium Machine Wash Shop The Organic Collection Here "
2025-01-24,859,change,description," 100% Organic Cotton Slim Fit Long Sleeve Premium Organic Cotton Brushed Marl Woven Fabrication Button Down Collar Constructed Working Cuffs Traditional Cut And Sew Button Placket Farah Branded Button Fastenings Curved Hem Embroidered Gold F Model Is 6'2"" And Wears Size Medium Machine Wash "," The Farah Steen Slim Fit Brushed Cotton shirt is the perfect addition to your wardrobe. Using 100% organic brushed cotton for a soft-touch, smart casual look with premium elegance; the slim-fit, long-sleeve design details a traditional button-down collar with signature gold embroidered Farah logo at the left chest. 100% Organic Cotton Slim Fit Long Sleeve Premium Organic Cotton Brushed Marl Woven Fabrication Button Down Collar Constructed Working Cuffs Traditional Cut And Sew Button Placket Farah Branded Button Fastenings Curved Hem Embroidered Gold F Model Is 6'2"" And Wears Size Medium Machine Wash Shop The Organic Collection Here "
2025-01-24,891,change,description," 100% Organic Cotton Regular Fit Short Sleeve Premium Organic Cotton Pique Fabrication 3 Button Grown On Placket Ribbed Collar And Cuff 4 Colour Contrast Tipping Layout On Collar And Cuffs Twin Needle Finishing At The Hem Embroidered Gold F Model Is 6'2"" And Wears Size Medium Machine Wash "," Our polo shirts are always of premium quality, and this Alvin Tipped Collar polo is no exception. Offering a comfortable regular fit with short sleeves, this shirt is made from 100% organic cotton pique fabrication so you’re guaranteed to feel as good as you look. For those small details that can make all the difference, this polo also features 4 colour contrast tipping layout on the collar and cuffs, twin needle finishing at the hem, and - most importantly - the embroidered gold F branding on the chest. 100% Organic Cotton Regular Fit Short Sleeve Premium Organic Cotton Pique Fabrication 3 Button Grown On Placket Ribbed Collar And Cuff 4 Colour Contrast Tipping Layout On Collar And Cuffs Twin Needle Finishing At The Hem Embroidered Gold F Model Is 6'2"" And Wears Size Medium Machine Wash Shop The Organic Collection Here "
2025-01-24,925,new,farah_product_id,15001391497603,
2025-01-24,920,change,description," 100% Organic Cotton Slim Fit Short Sleeve Premium Organic Cotton Pique Fabrication 3 Button Grown On Placket Ribbed Collar And Cuff Twin Needle Finish To Hem Embroidered Gold F Model Is 6'2"" And Wears Size Medium Machine Wash "," A timeless piece that is anything but basic, the Farah Blanes is a slim-fit, short-sleeved polo shirt that features classic Farah design details including a three-button placket, piqué fabrication, and ribbed collar and cuffs. Made from 100% organic cotton, the short-sleeve polo comes with our signature gold Farah logo on the left chest. 100% Organic Cotton Slim Fit Short Sleeve Premium Organic Cotton Pique Fabrication 3 Button Grown On Placket Ribbed Collar And Cuff Twin Needle Finish To Hem Embroidered Gold F Model Is 6'2"" And Wears Size Medium Machine Wash Shop The Organic Collection Here "
2025-01-24,897,change,description," 100% Organic Cotton Regular Fit Short Sleeve Premium Organic Cotton Jersey Fabrication Set In Ribbed Collar Twin Needle Finish To Cuffs And Hem Embroidered Gold F Model Is 6'2"" And Wears Size Medium Machine Wash "," Your basic pieces should be anything but. Our Danny tee is made from 100% organic cotton, soft against your skin and highly breathable. The regular fit and short sleeves make it the perfect accompaniment for any outfit; wear with jeans or chinos or layer a jumper on top when there’s a chill in the air. Look closer and you’ll notice those classic Farah details you’ve come to expect, including a set in ribbed collar and twin needle finishes to the cuffs and hem. And, of course, the embroidered golf F branding on the chest. 100% Organic Cotton Regular Fit Short Sleeve Premium Organic Cotton Jersey Fabrication Set In Ribbed Collar Twin Needle Finish To Cuffs And Hem Embroidered Gold F Model Is 6'2"" And Wears Size Medium Machine Wash Shop The Organic Collection Here "
2025-01-24,858,change,description," 100% Organic Cotton Slim Fit Long Sleeve Premium Organic Cotton Brushed Marl Woven Fabrication Button Down Collar Constructed Working Cuffs Traditional Cut And Sew Button Placket Farah Branded Button Fastenings Curved Hem Embroidered Gold F Model Is 6'2"" And Wears Size Medium Machine Wash "," The Farah Steen Slim Fit Brushed Cotton shirt is the perfect addition to your wardrobe. Using 100% organic brushed cotton for a soft-touch, smart casual look with premium elegance; the slim-fit, long-sleeve design details a traditional button-down collar with signature gold embroidered Farah logo at the left chest. 100% Organic Cotton Slim Fit Long Sleeve Premium Organic Cotton Brushed Marl Woven Fabrication Button Down Collar Constructed Working Cuffs Traditional Cut And Sew Button Placket Farah Branded Button Fastenings Curved Hem Embroidered Gold F Model Is 6'2"" And Wears Size Medium Machine Wash Shop The Organic Collection Here "
2025-01-24,899,change,description," 100% Organic Cotton Slim Fit Short Sleeve Premium Organic Cotton Pique Fabrication 3 Button Grown On Placket Ribbed Collar And Cuff Twin Needle Finish To Hem Embroidered Gold F Model Is 6'2"" And Wears Size Medium Machine Wash "," A timeless piece that is anything but basic, the Farah Blanes is a slim-fit, short-sleeved polo shirt that features classic Farah design details including a three-button placket, piqué fabrication, and ribbed collar and cuffs. Made from 100% organic cotton, the short-sleeve polo comes with our signature gold Farah logo on the left chest. 100% Organic Cotton Slim Fit Short Sleeve Premium Organic Cotton Pique Fabrication 3 Button Grown On Placket Ribbed Collar And Cuff Twin Needle Finish To Hem Embroidered Gold F Model Is 6'2"" And Wears Size Medium Machine Wash Shop The Organic Collection Here "
2025-01-24,851,change,description," 100% Organic Cotton Slim Fit Long Sleeve Premium Organic Cotton Woven Oxford Fabrication Button Down Collar Constructed Working Cuffs Traditional Cut And Sew Button Placket Farah Branded Button Fastenings Curved Hem Embroidered Gold F Model Is 6'2"" And Wears Size Medium Machine Wash "," The Farah Brewer Oxford shirt is an essential, modern menswear classic. Expertly crafted from 100% organic cotton, the Brewer Oxford shirt boasts a button-down collar, long sleeves, and a curved hem for a stylish, must-have wardrobe staple. The Oxford weave provides a classic feel with added durability, while the signature gold Farah logo provides the perfect finishing touch. 100% Organic Cotton Slim Fit Long Sleeve Premium Organic Cotton Woven Oxford Fabrication Button Down Collar Constructed Working Cuffs Traditional Cut And Sew Button Placket Farah Branded Button Fastenings Curved Hem Embroidered Gold F Model Is 6'2"" And Wears Size Medium Machine Wash Shop The Organic Collection Here "
2025-01-24,901,change,description," 100% Organic Cotton Slim Fit Crew Neck Premium Organic Cotton Loopback Jersey Fabrication Set In Rib Collar With Chain-Stitched Rib Reinforcement Ribbed Cuffs And Hem Embroidered Gold F Branding Model Is 6'2"" And Wears Size Medium Machine Wash "," Expertly crafted from organic cotton, the Tim Sweatshirt features a premium loopback jersey fabrication for ultimate comfort. The ribbed collar with chain-stitched rib reinforcement adds durability, while the ribbed cuffs and hem provide a snug fit. Finished with an embroidered Farah logo, this sweatshirt is a must-have for any wardrobe. 100% Organic Cotton Slim Fit Crew Neck Premium Organic Cotton Loopback Jersey Fabrication Set In Rib Collar With Chain-Stitched Rib Reinforcement Ribbed Cuffs And Hem Embroidered Gold F Branding Model Is 6'2"" And Wears Size Medium Machine Wash Shop The Organic Collection Here "
2025-01-24,903,change,description," 100% Organic Cotton Slim Fit Premium Organic Cotton Loopback Jersey Fabrication Set In Funnel-Neck Collar With A Metal Farah Branded Ring-Puller Chain-Stitched Raglan Sleeve Construction Ribbed Neck, Cuffs And Hem Embroidered Gold F Branding Model Is 6'2"" And Wears Size Medium Machine Wash "," Made from 100% organic cotton, the Farah Jim sweatshirt features a quarter-zip set into a deep, ribbed-neck collar. With matching detailing on the hem and cuffs, the slim-fit sweatshirt is available with our signature gold Farah logo at the left chest. 100% Organic Cotton Slim Fit Premium Organic Cotton Loopback Jersey Fabrication Set In Funnel-Neck Collar With A Metal Farah Branded Ring-Puller Chain-Stitched Raglan Sleeve Construction Ribbed Neck, Cuffs And Hem Embroidered Gold F Branding Model Is 6'2"" And Wears Size Medium Machine Wash Shop The Organic Collection Here "
2025-01-24,904,change,description," 100% Organic Cotton Relaxed Fit 12 Gauge Knitted Construction With 2 Colour Jacquard Detailing Oversized Knitted Collar And Placket Tonal Ribbed Collar And Cuff Cut And Sew Armhole Construction Embroidered Gold F Model Is 6'2"" And Wears Size Medium Machine Wash "," 100% Organic Cotton Relaxed Fit 12 Gauge Knitted Construction With 2 Colour Jacquard Detailing Oversized Knitted Collar And Placket Tonal Ribbed Collar And Cuff Cut And Sew Armhole Construction Embroidered Gold F Model Is 6'2"" And Wears Size Medium Machine Wash Shop The Organic Collection Here "
